{
  "schema": "date-v3-plan-v1",
  "plan_id": "phase0_import",
  "title": "Read-only import of frozen DC/GLS runs",
  "runs": [
    {
      "run_id": "20260830_cmr_thin_l1_hop_del050_ackin050",
      "design_id": "ASYNC_THIN_1X1",
      "benchmark_id": "R-U5",
      "adapter": "import_readonly",
      "physical_class": "post-synthesis",
      "paper_eligible": false,
      "notes": "Thin L1 hop MAXIMUM SDF; paper-eligible as post-synthesis calibrated hop (DATE V3 does not replace with post-route)."
    },
    {
      "run_id": "20260830_cmr_thin_l2_hop_del050_ackin050",
      "design_id": "ASYNC_THIN_1X1",
      "benchmark_id": "R-U5",
      "adapter": "import_readonly",
      "physical_class": "post-synthesis",
      "paper_eligible": false,
      "notes": "Thin L2 hop MAXIMUM SDF; paper-eligible as post-synthesis calibrated hop (DATE V3 does not replace with post-route)."
    },
    {
      "run_id": "20260830_cmr_thin_l3_hop_del050_ackin050",
      "design_id": "ASYNC_THIN_1X1",
      "benchmark_id": "R-U5",
      "adapter": "import_readonly",
      "physical_class": "post-synthesis",
      "paper_eligible": false,
      "notes": "Thin L3 hop MAXIMUM SDF; paper-eligible as post-synthesis calibrated hop (DATE V3 does not replace with post-route)."
    },
    {
      "run_id": "20260830_cmr_fat_l1_hop_del050_ackin050",
      "design_id": "ASYNC_FAT_1X2",
      "benchmark_id": "R-U5",
      "adapter": "import_readonly",
      "physical_class": "post-synthesis",
      "paper_eligible": false,
      "notes": "Fat L1 hop MAXIMUM SDF; paper-eligible as post-synthesis calibrated hop (DATE V3 does not replace with post-route)."
    },
    {
      "run_id": "20260830_cmr_fat_l2_hop_del050_ackin050",
      "design_id": "ASYNC_PROP_2X2",
      "benchmark_id": "R-U5",
      "adapter": "import_readonly",
      "physical_class": "post-synthesis",
      "paper_eligible": false,
      "notes": "PROP L2 hop MAXIMUM SDF; paper-eligible as post-synthesis calibrated hop (DATE V3 does not replace with post-route)."
    },
    {
      "run_id": "20260830_cmr_fat_l3_hop_del050_ackin050",
      "design_id": "ASYNC_PROP_2X2",
      "benchmark_id": "R-U5",
      "adapter": "import_readonly",
      "physical_class": "post-synthesis",
      "paper_eligible": false,
      "notes": "PROP L3 hop MAXIMUM SDF; paper-eligible as post-synthesis calibrated hop (DATE V3 does not replace with post-route)."
    },
    {
      "run_id": "20260830_cmr_router_level_baseline_del050",
      "design_id": "ASYNC_THIN_1X1",
      "benchmark_id": "R-U5",
      "adapter": "import_readonly",
      "physical_class": "post-synthesis",
      "paper_eligible": false,
      "notes": "Hop PPA summary folder. Do not overwrite."
    },
    {
      "run_id": "20260831_014622_cmr_sync_noc64_thin_p50",
      "design_id": "SYNC_THIN_1X1",
      "benchmark_id": null,
      "adapter": "import_readonly",
      "physical_class": "archive-only",
      "paper_eligible": false,
      "notes": "Phase 2 Thin SyncNoC64 1.0 ns, 2-cycle Head. Archive-only. Do not overwrite."
    },
    {
      "run_id": "20260831_084457_cmr_sync_noc64_fat1222_p50",
      "design_id": "SYNC_PROP_2X2",
      "benchmark_id": null,
      "adapter": "import_readonly",
      "physical_class": "archive-only",
      "paper_eligible": false,
      "notes": "Phase 2 Fat 1-2-2-2 SyncNoC64 1.0 ns, 3-cycle Head path. Archive-only. Do not overwrite."
    },
    {
      "run_id": "20260901_cmr_sync_noc64_thin_p50",
      "design_id": "SYNC_THIN_1X1",
      "benchmark_id": null,
      "adapter": "dc_sync_noc64",
      "physical_class": "post-synthesis",
      "paper_eligible": true,
      "notes": "Phase 2.5 1-cycle Head Thin SyncNoC64 1.0 ns MAXIMUM-SDF. Do not overwrite."
    },
    {
      "run_id": "20260901_cmr_sync_noc64_fat1222_p50",
      "design_id": "SYNC_PROP_2X2",
      "benchmark_id": null,
      "adapter": "dc_sync_noc64",
      "physical_class": "post-synthesis",
      "paper_eligible": true,
      "notes": "Phase 2.5 1-cycle Head Fat 1-2-2-2 SyncNoC64 1.0 ns MAXIMUM-SDF. Do not overwrite."
    },
    {
      "run_id": "20260903_101701_cmr_descal_fm64_del150",
      "design_id": "FM64",
      "benchmark_id": null,
      "adapter": "network_sdf",
      "physical_class": "post-synthesis",
      "paper_eligible": true,
      "notes": "Signed 64-node flat mesh paper baseline, RCU 1xDEL150 / Ackin 1xDEL050. Replaces placeholder cmr_mesh64_current. Do not overwrite."
    },
    {
      "run_id": "20260830_095259_cmr_noc64_p50_1222",
      "design_id": "PROP64",
      "benchmark_id": null,
      "adapter": "import_readonly",
      "physical_class": "archive-only",
      "paper_eligible": false,
      "archive_only_reason": "Ackin DEL250 predecessor. Not the hop delay recipe. Archive-only.",
      "notes": "Must not enter curated or Table I/Fig A delay comparison."
    },
    {
      "run_id": "20260828_cmr_cfifo_tp_nogrant_p50",
      "design_id": "THIN64",
      "benchmark_id": null,
      "adapter": "import_readonly",
      "physical_class": "archive-only",
      "paper_eligible": false,
      "archive_only_reason": "Thin NoC16 CFifo with RCU matched BUFFD0. Archive-only.",
      "notes": "CFifo/BUFFD0 laboratory netlist."
    }
  ]
}
